{
	"id": "pie061",
	"src": "CHIME-pie",
	"no.": "061",
	"width": 400,
	"height": 300,
	"textelements": [ 
		{
			"content": "Pie Chart Example",
			"boundingbox": {
				"center_x": 49,
				"center_y": 7,
				"width": 97,
				"height": 11,
				"orientation": 0
			}
		},
		{
			"content": "Item 1 17",
			"boundingbox": {
				"center_x": 284,
				"center_y": 208,
				"width": 26,
				"height": 22,
				"orientation": 0
			}
		},
		{
			"content": "Item 2 28",
			"boundingbox": {
				"center_x": 84,
				"center_y": 62,
				"width": 28,
				"height": 22,
				"orientation": 0
			}
		},
		{
			"content": "Item 3 5",
			"boundingbox": {
				"center_x": 126,
				"center_y": 265,
				"width": 28,
				"height": 22,
				"orientation": 0
			}
		}
	]
}