{
	"id": "dbar002",
	"src": "CHIME-dbar",
	"no.": "002",
	"width": 383,
	"height": 325,
	"textelements": [ 
		{
			"content": "Use of Library Services FY 1998/99",
			"boundingbox": {
				"center_x": 191,
				"center_y": 21,
				"width": 213,
				"height": 12,
				"orientation": 0
			}
		},
		{
			"content": "20,000",
			"boundingbox": {
				"center_x": 28,
				"center_y": 59,
				"width": 31,
				"height": 9,
				"orientation": 0
			}
		},
		{
			"content": "10,000",
			"boundingbox": {
				"center_x": 28,
				"center_y": 159,
				"width": 31,
				"height": 9,
				"orientation": 0
			}
		},
		{
			"content": "0",
			"boundingbox": {
				"center_x": 42,
				"center_y": 258,
				"width": 4,
				"height": 7,
				"orientation": 0
			}
		},
		{
			"content": "circulation",
			"boundingbox": {
				"center_x": 84,
				"center_y": 274,
				"width": 46,
				"height": 7,
				"orientation": 0
			}
		},
		{
			"content": "reserves",
			"boundingbox": {
				"center_x": 147,
				"center_y": 275,
				"width": 42,
				"height": 5,
				"orientation": 0
			}
		},
		{
			"content": "interlibrary loan",
			"boundingbox": {
				"center_x": 210,
				"center_y": 282,
				"width": 49,
				"height": 22,
				"orientation": 0
			}
		},
		{
			"content": "reference (closed stacks)",
			"boundingbox": {
				"center_x": 273,
				"center_y": 290,
				"width": 46,
				"height": 39,
				"orientation": 0
			}
		},
		{
			"content": "freshmen",
			"boundingbox": {
				"center_x": 352,
				"center_y": 145,
				"width": 44,
				"height": 7,
				"orientation": 0
			}
		},
		{
			"content": "seniors",
			"boundingbox": {
				"center_x": 347,
				"center_y": 164,
				"width": 34,
				"height": 7,
				"orientation": 0
			}
		}
	]
}