{
	"id": "line046",
	"src": "CHIME-line",
	"no.": "046",
	"width": 615,
	"height": 436,
	"textelements": [ 
		{
			"content": "30,000",
			"boundingbox": {
				"center_x": 62,
				"center_y": 24,
				"width": 34,
				"height": 11,
				"orientation": 0
			}
		},
		{
			"content": "28,000",
			"boundingbox": {
				"center_x": 62,
				"center_y": 54,
				"width": 34,
				"height": 11,
				"orientation": 0
			}
		},
		{
			"content": "26,000",
			"boundingbox": {
				"center_x": 62,
				"center_y": 84,
				"width": 34,
				"height": 11,
				"orientation": 0
			}
		},
		{
			"content": "24,000",
			"boundingbox": {
				"center_x": 62,
				"center_y": 114,
				"width": 34,
				"height": 11,
				"orientation": 0
			}
		},
		{
			"content": "22,000",
			"boundingbox": {
				"center_x": 62,
				"center_y": 144,
				"width": 34,
				"height": 11,
				"orientation": 0
			}
		},
		{
			"content": "20,000",
			"boundingbox": {
				"center_x": 62,
				"center_y": 174,
				"width": 34,
				"height": 11,
				"orientation": 0
			}
		},
		{
			"content": "18,000",
			"boundingbox": {
				"center_x": 62,
				"center_y": 204,
				"width": 33,
				"height": 11,
				"orientation": 0
			}
		},
		{
			"content": "16,000",
			"boundingbox": {
				"center_x": 62,
				"center_y": 234,
				"width": 33,
				"height": 11,
				"orientation": 0
			}
		},
		{
			"content": "14,000",
			"boundingbox": {
				"center_x": 62,
				"center_y": 264,
				"width": 33,
				"height": 11,
				"orientation": 0
			}
		},
		{
			"content": "12,000",
			"boundingbox": {
				"center_x": 62,
				"center_y": 294,
				"width": 33,
				"height": 11,
				"orientation": 0
			}
		},
		{
			"content": "10,000",
			"boundingbox": {
				"center_x": 62,
				"center_y": 324,
				"width": 33,
				"height": 11,
				"orientation": 0
			}
		},
		{
			"content": "Growth",
			"boundingbox": {
				"center_x": 25,
				"center_y": 173,
				"width": 10,
				"height": 42,
				"orientation": 0
			}
		},
		{
			"content": "1995",
			"boundingbox": {
				"center_x": 89,
				"center_y": 344,
				"width": 31,
				"height": 10,
				"orientation": 0
			}
		},
		{
			"content": "1996",
			"boundingbox": {
				"center_x": 137,
				"center_y": 344,
				"width": 31,
				"height": 10,
				"orientation": 0
			}
		},
		{
			"content": "1997",
			"boundingbox": {
				"center_x": 185,
				"center_y": 344,
				"width": 31,
				"height": 10,
				"orientation": 0
			}
		},
		{
			"content": "1998",
			"boundingbox": {
				"center_x": 233,
				"center_y": 344,
				"width": 31,
				"height": 10,
				"orientation": 0
			}
		},
		{
			"content": "1999",
			"boundingbox": {
				"center_x": 289,
				"center_y": 344,
				"width": 31,
				"height": 10,
				"orientation": 0
			}
		},
		{
			"content": "2000",
			"boundingbox": {
				"center_x": 346,
				"center_y": 344,
				"width": 32,
				"height": 10,
				"orientation": 0
			}
		},
		{
			"content": "2001",
			"boundingbox": {
				"center_x": 401,
				"center_y": 344,
				"width": 30,
				"height": 10,
				"orientation": 0
			}
		},
		{
			"content": "2002",
			"boundingbox": {
				"center_x": 449,
				"center_y": 344,
				"width": 31,
				"height": 10,
				"orientation": 0
			}
		},
		{
			"content": "2003",
			"boundingbox": {
				"center_x": 497,
				"center_y": 344,
				"width": 31,
				"height": 10,
				"orientation": 0
			}
		},
		{
			"content": "2004",
			"boundingbox": {
				"center_x": 546,
				"center_y": 344,
				"width": 32,
				"height": 10,
				"orientation": 0
			}
		},
		{
			"content": "2005",
			"boundingbox": {
				"center_x": 593,
				"center_y": 344,
				"width": 31,
				"height": 10,
				"orientation": 0
			}
		}
	]
}