{
	"id": "pie044",
	"src": "CHIME-pie",
	"no.": "044",
	"width": 420,
	"height": 279,
	"textelements": [ 
		{
			"content": "King County 11.4%",
			"boundingbox": {
				"center_x": 165,
				"center_y": 16,
				"width": 52,
				"height": 20,
				"orientation": 0
			}
		},
		{
			"content": "Kent School District 37.4%",
			"boundingbox": {
				"center_x": 45,
				"center_y": 135,
				"width": 83,
				"height": 20,
				"orientation": 0
			}
		},
		{
			"content": "State School Support 21.9%",
			"boundingbox": {
				"center_x": 228,
				"center_y": 244,
				"width": 89,
				"height": 19,
				"orientation": 0
			}
		},
		{
			"content": "Library District 5.8%",
			"boundingbox": {
				"center_x": 330,
				"center_y": 166,
				"width": 62,
				"height": 20,
				"orientation": 0
			}
		},
		{
			"content": "King County Fire District #37 10.3%",
			"boundingbox": {
				"center_x": 331,
				"center_y": 109,
				"width": 71,
				"height": 32,
				"orientation": 0
			}
		},
		{
			"content": "Port of Seattle 2.0%",
			"boundingbox": {
				"center_x": 303,
				"center_y": 60,
				"width": 58,
				"height": 20,
				"orientation": 0
			}
		},
		{
			"content": "City of Covington 10.2%",
			"boundingbox": {
				"center_x": 274,
				"center_y": 29,
				"width": 72,
				"height": 20,
				"orientation": 0
			}
		}
	]
}